X,Y,OBJECTID,CommunityName,CommunityID,RoadConnection,Description,AsOfDate
252540.636570125,1132499.53625932,384,Seward,{86E9E60C-762A-4D26-A7CC-57DC74916D5B},Yes,"Seward is connected to the Alaska Highway system by the Seward Highway. Bus and commercial trucking services to and from Anchorage are available daily. While air services and charters are available at the state-owned airport, regularly scheduled commercial air service out of Seward is not available. Two paved runways are utilized. Seasonal passenger transportation is available by rail, as Seward is a major transit site for the Alaska Railroad. The port, located at the north end of the 900 foot deep Resurrection Bay, serves cruise ships, cargo barges, and ocean freighters from Seattle and overseas. The small boat harbor has moorage for 650 boats and 2 boat launch ramps as well as a 250 ton boat lift and a 5,000 ton lift for ships and barges.",2023/08/24 08:00:00+00
451200.737331008,1366697.89131631,391,Silver Springs,{EFEF6D9F-D6F7-4657-8942-88A418AFEAD4},Yes,The Richardson Highway connects to all major population areas of the state year-round. Residents use the airport at Glennallen.,2023/08/24 08:00:00+00
1042115.23995418,1199030.95630824,393,Skagway,{F040B0E7-B5F6-47BE-82E0-63A3AC90CEC9},Yes,"The Municipality of Skagway is accessible by road via the Klondike Highway, which provides a connection through British Columbia and the Yukon Territory, Canada, to the lower 48 states or north to Interior Alaska. Skagway is accessed by air, road, and water services. The state owns a paved runway and Skagway receives regular state ferry and barge services. A breakwater, ferry terminal, small boat harbor, boat launch and boat haul-out are available, as well as three deep-draft docks for cruise and cargo ship berthing, cargo loading and storage. Freight arrives by barge, ferry and truck.",2023/08/24 08:00:00+00
509907.186959205,1453550.80144447,395,Slana,{92647992-DE7B-4457-BD55-CB46CE9A4C4E},Yes,"Slana has road access to the statewide system via Glenn and Richardson Highways. The nearest public airstrip is to the south at Chistochina, but a private gravel airstrip exists.",2023/08/24 08:00:00+00
160632.581953389,1170692.1222477,397,Soldotna,{D7CCEBD6-7236-44C6-9E78-19F98183CFFC},Yes,"The Soldotna Municipal Airport provides facilities for charter services and local air traffic. The nearby Kenai Municipal Airport, located 10 miles away, offers scheduled flights and float plane facilities. Seaplanes can also land at Mackeys Lakes. There are four additional private landing strips in Soldotna and a heliport for medical emergencies at Central Peninsula General Hospital. The Sterling Highway provides access to Alaska's road system. While Soldotna has an airport, there are no regular commercial flights available between Soldotna and Anchorage.",2023/08/24 08:00:00+00
247676.573852584,1298588.90493292,399,South Lakes,{84B4826F-176E-4EF4-B844-179B36558677},Yes,,2023/08/24 08:00:00+00
295956.11995334,1663903.37771941,401,South Van Horn,{06C11331-3BBB-4E38-B7C8-8E9706C868E8},Yes,South Van Horn is a neighborhood just south of Fairbanks. It is about three miles by road from the center of the city.,2023/08/24 08:00:00+00
307884.478915851,1674157.73985496,404,Steele Creek,{70C8E48C-BFDB-49A3-ABA9-0B244839932A},Yes,,2023/08/24 08:00:00+00
175086.911222971,1176576.00005833,405,Sterling,{DC7B95CA-114F-4D3E-95BE-B7965D32E2EF},Yes,"The Sterling Highway provides access to Alaska's road system. There are several private airstrips in the Sterling area, and a private seaplane base at Scout Lake which is approximately three miles from the center of Sterling. There are two privately-operated boat launches. Nearby Kenai and Soldotna offer airports for charter services and local air traffic, as well as docking facilities. Sterling does not have a municipal airport, and nearby Soldotna does not offer regularly scheduled air service between Soldotna and Anchorage. However, Anchorage is accessible from Sterling by road and is approximately 135 miles away.",2023/08/24 08:00:00+00
247253.877321166,1219683.79706974,408,Sunrise,{C94A527A-FE5F-481B-BCAA-88435D1E5189},Yes,Sunrise has access to Alaska's road system via the Seward highway. A gravel airstrip is available nearby at Hope.,2023/08/24 08:00:00+00
205613.297295645,1356772.61488656,411,Susitna North,{3366F161-F33D-48D6-A9DD-79C2B203D73C},Yes,"The community is accessible from the George Parks Highway. The Talkeetna airstrip is located nearby. A variety of transportation means are available in Wasilla, Palmer, and Anchorage.",2023/08/24 08:00:00+00
269749.486823827,1313906.37237335,412,Sutton-Alpine,{126A149F-F9BD-42EC-8D66-E4883B8016E2},Yes,"Sutton is connected to the Glenn Highway. There is a public gravel airstrip at the Jonesville Mine, owned by the Canadian Mine & Smeltering Company. Additional public transportation facilities are available in nearby Palmer.",2023/08/24 08:00:00+00
200806.566477601,1377989.09479474,414,Talkeetna,{3EC46053-F188-4C9A-B758-A0D57EF8F834},Yes,"Talkeetna is accessible by road, air, and train. The Talkeetna Spur Road connects to the George Parks Highway. There are two state-owned runways. One is asphalt and the other is a gravel strip. There are several additional airstrips in the vicinity, including one owned by the U.S. Bureau of Land Management. There is an Alaska Railroad depot. While Talkeetna is accessible to charter and private aircraft, there is no regularly scheduled service between Talkeetna and Anchorage, which can be reached by road.",2023/08/24 08:00:00+00
528914.501725091,1532292.0107361,415,Tanacross,{57519FBB-A615-4BD0-A451-9E4C5B1C2E43},Yes,"Tanacross is located on the Alaska Highway, roughly 200 miles southeast of Fairbanks. Tanacross has a federally-maintained public airport with an asphalt runway in poor condition. Tanacross is a mile north of the Alaska Highway. Most residents use cars, trucks, and snow machines for local transportation. Regular air and bus services are available from Tok. The U.S. Bureau of Land Management owns two runways located one mile south of Tanacross and are not maintained in winter.",2023/08/24 08:00:00+00
243842.042777831,1300864.17626285,416,Tanaina,{929B664D-4B19-44FF-A034-299BEAC5D45E},Yes,"The George Parks and Glenn Highways and other local roads connect the area Alaska's road system. It lies on the Alaska Railroad. The nearby Wasilla and Palmer airports provide scheduled commuter and air taxi services. Float planes land at Wasilla Lake, Jacobsen Lake, and Lake Lucille. There are ten additional private airstrips in the vicinity. Commercial jet flights are operated out of Anchorage International Airport.",2023/08/24 08:00:00+00
446540.486937791,1370184.46588024,419,Tazlina,{A3685B4F-070E-4C85-9820-DEE25ABC695E},Yes,Tazlina is located on the Richardson Highway. There is a state-owned gravel airstrip and a seaplane facility at Smokey Lake.,2023/08/24 08:00:00+00
574650.660762974,1512987.73354109,423,Tetlin,{AD7719EE-1C6A-44A6-93BB-D7ABA23FFF53},Yes,"Tetlin is located along the Tetlin River and the Alaska Highway, about 220 miles southeast of Fairbanks. Tetlin has a state-maintained public airport with a gravel runway in good condition. The village also owns and maintains a turf airstrip. Scheduled and charter flights are available from Tok. Many residents own cars, trucks, skiffs, and snow machines for hunting, fishing, and hauling wood.",2023/08/24 08:00:00+00
547792.116039577,1530825.07227062,428,Tok,{E7AB4B30-0C1D-4536-8571-A8835525D851},Yes,Tok is located on the Alaska Highway about 200 miles southeast of Fairbanks. Tok has two private airports and one state-maintained public airport with a 2509' x 50' asphalt runway in good condition.,2023/08/24 08:00:00+00
409618.895736735,1371188.85206154,430,Tolsona,{93A518D2-76B0-46E5-863A-02EDDEB80C98},Yes,"The community lies on the Glenn Highway and accesses the statewide road system. There are several air strips in the area, and air taxi services are available. A seaplane base is used on Tolsona Lake.",2023/08/24 08:00:00+00
464272.45127877,1328969.74919329,431,Tonsina,{793D84BA-F572-4A23-A265-0090CCDE0F70},Yes,"Tonsina is connected to the remainder of the state road system by the Richardson Highway. A state-owned airstrip is available at Upper Tonsina, and other airstrips are in the vicinity.",2023/08/24 08:00:00+00
194568.399082334,1376852.35197144,432,Trapper Creek,{68659E20-597A-4214-97E4-BE2A722B888B},Yes,"Trapper Creek is accessible from the George Parks Highway. A variety of transportation means are available in Wasilla, Palmer, and Anchorage. ERA Aviation operates a private heliport in Trapper Creek. Several private airstrips are in the vicinity.",2023/08/24 08:00:00+00
329249.564159639,1674644.09069427,437,Two Rivers,{2416B7D2-6E1E-47A0-8550-530D41B50117},Yes,"Local roads connect to the Alaska road system. Faribanks' transportation facilities provide airport, railway, and highway connections.",2023/08/24 08:00:00+00
256268.324633774,1554469.2956292,447,Usibelli,{BDD6F083-947B-49D1-8373-99EB4FAC1EAD},Yes,,2023/08/24 08:00:00+00
409518.872278663,1262298.70131742,450,Valdez,{BDF957A0-FB1E-48AC-835A-A24FB2DFE444},Yes,"The Richardson Highway connects Valdez to Alaska's road system. Valdez is 305 road miles southeast of Anchorage. The Port of Valdez is ice-free throughout the year, and is navigated by hundreds of ocean-going oil cargo vessels each year. Valdez has the largest floating concrete dock in the world, with a 1,200-foot front and water depth exceeding 80 feet. Numerous cargo and container facilities are present in Valdez, as well as boat harbors. Both barges and trucking services deliver cargo to the City. The Alaska Marine Highway Ferry System provides transport to Cordova, Tatitlek, Whittier, and Chenega Bay in Prince William Sound, to Kodiak, Ouzinke, Port Lions, and Old Harbor on Kodiak Island, and to Seward, Seldovia, and Homer on the Kenai Peninsula. The Valdez airport is operated by the State and has a paved runway. In addition, a seaplane base is located at Robe Lake, approximately eight road miles southeast of town.",2023/08/24 08:00:00+00
162354.134025602,1092835.21425893,452,Voznesenka Village,{71833F98-63B0-41B7-8D06-F86C7A19B0BD},Yes,,2023/08/24 08:00:00+00
240926.821971153,1297506.21747755,456,Wasilla,{8805779A-5590-497A-82CB-9053953A6555},Yes,"Wasilla is well connected by land to surrounding communities. The George Parks Highway and Glenn Highway connect Wasilla to Anchorage, Fairbanks, Denali National Park, and Palmer, as well as a number of smaller communities. The Alaska Railroad serves Wasilla on the Anchorage to Fairbanks route, while Mat-Su Valley Public Transportation provides bus service between Wasilla, Palmer, and Anchorage. Commercial air service is available at Anchorage International Airport, located 45 miles away. Wasilla's municipal airport has a paved runway with parking for transient aircraft. Numerous additional private airstrips also operate in the vicinity. Float planes land at Wasilla Lake, Jacobsen Lake, and Lake Lucille.",2023/08/24 08:00:00+00
288184.759092788,1210202.02666098,461,Whittier,{52F6D695-370B-4814-8DA9-00DCC073CA83},Yes,"Whittier has an ice-free port and two city docks (70' cargo dock and 60' floating passenger dock). A small boat harbor has slips for 360 fishing, recreation, and charter vessels. It is served by road, rail, the state ferry, boat, and aircraft. Since 2000, a tunnel has provided a road connection. The Anton Anderson Memorial Tunnel was reconstructed to accommodate both rail and road vehicles. The railway carries passengers, vehicles, and cargo 12 miles from the Portage Station east of Girdwood. The state-owned gravel airstrip accommodates charter aircraft, and a city-owned seaplane dock is available for passenger transfer.",2023/08/24 08:00:00+00
208090.297793577,1313544.47508187,463,Willow,{60E92328-3CA2-4968-A065-270130CCEE76},Yes,"From the George Parks Highway, the area has access to the statewide highway system and the transportation facilities of Wasilla, Palmer, and Anchorage. There are two public airstrips: one is a state-owned gravel airstrip at mile 69.7 Parks Highway and the other is at Deshka Landing and owned by the Alaska Department of Natural Resources. There are five additional private strips and a seaplane base at Kashwitna Lake.",2023/08/24 08:00:00+00
461935.793690791,1344305.44556952,464,Willow Creek,{4957115F-806A-43E5-BBCE-B3E79864940B},Yes,The Richardson Highway provides year-round access to Alaska's road system. Airstrips are located nearby in Copper Center and Glennallen.,2023/08/24 08:00:00+00
167826.697097959,1943992.9572965,465,Wiseman,{7DC57B05-77B0-4489-8056-CFFC5747990D},Yes,The partially-paved Dalton Highway connects Wiseman to Alaska's road system. A state-owned gravel airstrip is available but is not consistently maintained.,2023/08/24 08:00:00+00
